{
  "id": "1",
  "userId": "1001",
  "billingAddress": {
    "address1": "Graceland",
    "address2": "646",
    "city": "Philadelphia",
    "state": "Pennsylvania",
    "postalCode": "19172",
    "country": "United States"
  },
  "payment": {
    "name": "John Doe",
    "number": "1323-12313-121321",
    "type": "VISA"
  },
  "products": [
    {
      "id": "1",
      "productName": "Artesia at Lakeside",
      "quantity": "1"
    }
  ],
  "status": "new",
  "price": "1304",
  "creationDate": "12/01/2015",
  "trackingNumber": "6a381a7a-65b8-4858-b884-d2897b7a5564"
}